"TID","EN","AR","CN","CNT","DE","ES","FA","FI","FR","ID","IT","JP","KR","MS","NL","NO","PT","RU","TH","TR","VI"
"string","string","string","string","string","string","string","string","string","string","string","string","string","string","string","string","string","string","string","string","string","string"
"TID_ACHIEVEMENT_DRAGON_SLAYER","Slay the Giant Dragon on the Campaign Map","اقض على التنين العملاق","在单人模式关卡\q龙穴历险\q中击败巨龙","在單人模式關卡\q巨龍巢穴\q中擊殺巨龍","Töte den Großen Drachen.","Acaba con el dragón gigante.","اژدهای غول‌پیکر را بکشید","Surmaa jättilohikäärme.","Tuez le dragon géant.","Tumbangkan Naga Raksasa","Uccidi il drago gigante","ジャイアントドラゴンを倒す。","자이언트 드래곤 처치","Bunuh Naga Gergasi","Versla de reuzendraak","Drep kjempedragen.","Acabe com o dragão gigante","Уничтожьте гигантского дракона","สังหารมังกรยักษ์","Dev Ejderhayı Öldür","Tiêu diệt con Rồng Khổng lồ"
"TID_BUILDING_CUSTOMIZE_CATEGORY_GROUND","Ground","الأرضية","地面","地面","Boden","Terrenos","محوطه","Maa","Sol","Darat","Terreno","地面","지면","Tanah","Grond","Bakke","Chão","Земля","พื้นดิน","Kara","Nền nhà"
"TID_ACHIEVEMENT_NPC_STARS3_TITLE","Get even more Goblins!","احصل على غيلان أكثر بكثير","消灭超多哥布林！","打倒超多哥布林！","Schnapp noch mehr Kobolde!","¡Acaba con más duendes!","هرچه بیش‌تر جن بگیرید!","Hanki lisää hiisiä!","Recrutez encore plus de gobelins","Dapatkan lebih banyak Goblin!","Prendi ancora altri goblin!","さらにゴブリンどもをやっつけろ！","더 많은 고블린 처치!","Dapatkan lebih banyak Goblin!","Krijg nog meer kobolden!","Få enda flere nisser!","Acabe com mais Goblins!","Покажите еще и тем гоблинам!","จัดการก็อบลินเพิ่มอีกสิ!","Daha da fazla goblini durdur!","Tiêu diệt nhiều Yêu tinh hơn nữa!"
"TID_INFERNO_TOWN_SCENERY","Inferno War Base Scenery","منظر قاعدة الحرب الناري","“烈焰之城”战争基地场景","「煉獄之城」戰爭基地場景","Inferno-Kriegsbasis-Szenerie","Paisaje infernal de la base de guerra","منظره پایه جنگ جهنمی","Inferno-sotakylämaisema","Décor base de guerre infernale","Latar Pangkalan Perang Inferno","Scenario infernale della base di guerra","クラン対戦拠点 「インフェルノの背景」","인페르노 전쟁 기지 배경","Latar Pangkalan Perang Membara","Infernostadomgeving voor de oorlogsbasis","Inferno-baselandskap","Paisagem da base de guerra infernal","Оформление для военной базы «Адский город»","ฉากฐานทัพสงครามเพลิงนรก","Cehennem Savaş Üssü Arka Planı","Phong cảnh Căn cứ Chiến đấu Hỏa ngục"
